{
  "format": "infopanel.document/1",
  "id": "00000000-0000-4000-8000-000000000000",
  "profile": {
    "name": "group-nested-hidden-child",
    "width": 340,
    "height": 120,
    "background": "#15191fff"
  },
  "items": [
    {
      "kind": "group",
      "id": "g064",
      "name": "Outer",
      "placement": {
        "x": 0,
        "y": 0
      },
      "children": [
        {
          "kind": "scene",
          "id": "g063",
          "name": "Square",
          "placement": {
            "x": 10,
            "y": 10
          },
          "layout": {
            "h": 100,
            "w": 100
          },
          "scene": {
            "format": "infopanel.scene/1",
            "nodes": [
              {
                "fill": "#00bfa5ff",
                "h": 100,
                "id": "shape",
                "kind": "rect",
                "w": 100
              }
            ]
          }
        },
        {
          "kind": "group",
          "id": "g060",
          "name": "Inner",
          "placement": {
            "x": 0,
            "y": 0
          },
          "children": [
            {
              "kind": "scene",
              "id": "g058",
              "name": "Inner group text",
              "placement": {
                "x": 130,
                "y": 20
              },
              "scene": {
                "format": "infopanel.scene/1",
                "nodes": [
                  {
                    "fill": "#f5f5f5ff",
                    "font": {
                      "family": "Inter",
                      "italic": false,
                      "size": 26.600000381469727,
                      "weight": 400
                    },
                    "id": "text",
                    "kind": "text",
                    "maxLines": 1,
                    "text": "Inner group text"
                  }
                ]
              }
            },
            {
              "kind": "scene",
              "id": "g059",
              "name": "Hidden ellipse",
              "visible": false,
              "placement": {
                "x": 130,
                "y": 60
              },
              "layout": {
                "h": 50,
                "w": 160
              },
              "scene": {
                "format": "infopanel.scene/1",
                "nodes": [
                  {
                    "cx": {
                      "args": [
                        160,
                        2
                      ],
                      "op": "div"
                    },
                    "cy": {
                      "args": [
                        50,
                        2
                      ],
                      "op": "div"
                    },
                    "fill": "#ff1744ff",
                    "id": "shape",
                    "kind": "ellipse",
                    "rx": {
                      "args": [
                        160,
                        2
                      ],
                      "op": "div"
                    },
                    "ry": {
                      "args": [
                        50,
                        2
                      ],
                      "op": "div"
                    },
                    "stroke": {
                      "paint": "#ff0000ff",
                      "width": 5
                    }
                  }
                ]
              }
            }
          ]
        },
        {
          "kind": "group",
          "id": "g062",
          "name": "Hidden group",
          "visible": false,
          "placement": {
            "x": 0,
            "y": 0
          },
          "children": [
            {
              "kind": "scene",
              "id": "g061",
              "name": "In hidden group",
              "placement": {
                "x": 200,
                "y": 70
              },
              "layout": {
                "h": 40,
                "w": 100
              },
              "scene": {
                "format": "infopanel.scene/1",
                "nodes": [
                  {
                    "fill": "#ffea00ff",
                    "h": 40,
                    "id": "shape",
                    "kind": "rect",
                    "stroke": {
                      "paint": "#ff0000ff",
                      "width": 5
                    },
                    "w": 100
                  }
                ]
              }
            }
          ]
        }
      ]
    }
  ]
}
