{
  "format": "infopanel.document/1",
  "id": "00000000-0000-4000-8000-000000000000",
  "profile": {
    "name": "text-glow-hard-light",
    "width": 320,
    "height": 70,
    "background": "#15191fff"
  },
  "items": [
    {
      "kind": "scene",
      "id": "g100",
      "name": "Fill",
      "placement": {
        "x": 0,
        "y": 0
      },
      "layout": {
        "h": 70,
        "w": 130
      },
      "scene": {
        "format": "infopanel.scene/1",
        "nodes": [
          {
            "fill": "#e8eaedff",
            "h": 70,
            "id": "shape",
            "kind": "rect",
            "w": 130
          }
        ]
      }
    },
    {
      "kind": "scene",
      "id": "g101",
      "name": "Fill",
      "placement": {
        "x": 130,
        "y": 0
      },
      "layout": {
        "h": 70,
        "w": 190
      },
      "scene": {
        "format": "infopanel.scene/1",
        "nodes": [
          {
            "fill": "#c62828ff",
            "h": 70,
            "id": "shape",
            "kind": "rect",
            "w": 190
          }
        ]
      }
    },
    {
      "kind": "scene",
      "id": "g099",
      "name": "Glowing text",
      "placement": {
        "x": 24,
        "y": 16
      },
      "scene": {
        "format": "infopanel.scene/1",
        "nodes": [
          {
            "blend": "hard-light",
            "children": [
              {
                "children": [
                  {
                    "fill": "#00e5ffff",
                    "font": {
                      "family": "Inter",
                      "italic": false,
                      "size": 34.58000183105469,
                      "weight": 700
                    },
                    "id": "halo",
                    "kind": "text",
                    "maxLines": 1,
                    "text": "Glowing text"
                  }
                ],
                "effects": [
                  {
                    "sigma": 8,
                    "type": "blur"
                  }
                ],
                "id": "halo-blur",
                "kind": "group"
              },
              {
                "fill": "#ffffffff",
                "font": {
                  "family": "Inter",
                  "italic": false,
                  "size": 34.58000183105469,
                  "weight": 700
                },
                "id": "text",
                "kind": "text",
                "maxLines": 1,
                "text": "Glowing text"
              }
            ],
            "id": "glow",
            "kind": "group"
          }
        ]
      }
    },
    {
      "kind": "scene",
      "id": "g102",
      "name": "Fill",
      "placement": {
        "x": 200,
        "y": 8
      },
      "layout": {
        "h": 54,
        "w": 56
      },
      "scene": {
        "format": "infopanel.scene/1",
        "nodes": [
          {
            "fill": "#2e7d32ff",
            "h": 54,
            "id": "shape",
            "kind": "rect",
            "w": 56
          }
        ]
      }
    }
  ]
}
