{
  "format": "infopanel.document/1",
  "id": "00000000-0000-4000-8000-000000000000",
  "profile": {
    "name": "clock",
    "width": 400,
    "height": 60,
    "background": "#15191fff"
  },
  "items": [
    {
      "kind": "scene",
      "id": "g016",
      "name": "Clock",
      "placement": {
        "x": 10,
        "y": 12
      },
      "scene": {
        "format": "infopanel.scene/1",
        "nodes": [
          {
            "fill": "#ffffffff",
            "font": {
              "family": "Inter",
              "italic": false,
              "size": 29.260000228881836,
              "weight": 400
            },
            "id": "text",
            "kind": "text",
            "maxLines": 1,
            "text": {
              "op": "formatTime",
              "pattern": "yyyy-MM-dd HH:mm:ss a"
            }
          }
        ]
      }
    }
  ]
}
