{
  "format": "infopanel.document/1",
  "id": "00000000-0000-4000-8000-000000000000",
  "profile": {
    "name": "text-center-box",
    "width": 320,
    "height": 60,
    "background": "#15191fff"
  },
  "items": [
    {
      "kind": "scene",
      "id": "g002",
      "name": "Box",
      "placement": {
        "x": 10,
        "y": 8
      },
      "layout": {
        "h": 44,
        "w": 300
      },
      "scene": {
        "format": "infopanel.scene/1",
        "nodes": [
          {
            "h": 44,
            "id": "shape",
            "kind": "rect",
            "stroke": {
              "paint": "#5c6370ff",
              "width": 1
            },
            "w": 300
          }
        ]
      }
    },
    {
      "kind": "scene",
      "id": "g003",
      "name": "Centred in 300 px",
      "placement": {
        "x": 10,
        "y": 14
      },
      "layout": {
        "w": 300
      },
      "scene": {
        "format": "infopanel.scene/1",
        "nodes": [
          {
            "align": "center",
            "fill": "#f5f5f5ff",
            "font": {
              "family": "Inter",
              "italic": false,
              "size": 26.600000381469727,
              "weight": 400
            },
            "id": "text",
            "kind": "text",
            "maxLines": 1,
            "overflow": "ellipsis",
            "text": "Centred in 300 px",
            "w": 300,
            "wrap": "word"
          }
        ]
      }
    }
  ]
}
